{
  "schema_version": 1,
  "database_version": "0.1.0-empty-development",
  "source": {
    "name": "No validated radionavigation source installed",
    "edition": "empty",
    "effective_from": null,
    "effective_to": null,
    "status": "DEVELOPMENT",
    "attribution": "EFIS NEXT placeholder; contains no frequencies",
    "sha256": "0000000000000000000000000000000000000000000000000000000000000000",
    "reference": null
  },
  "facilities": []
}
